{
  "id": "7f8a9b0c-1d2e-4f3a-5b6c-7d8e9f0a1b2c",
  "template_id": "2e3f4a5b-6c7d-4e8f-9a0b-1c2d3e4f5a6b",
  "recipient_email": "marie.dubois@example.fr",
  "recipient_user_id": "a1b2c3d4-e5f6-4a7b-8c9d-0e1f2a3b4c5d",
  "subject": "Rappel: Formation du Faire ensemble - Niveau Initiation commence dans 2 jours",
  "html_snapshot": "<html><body><h1>Bonjour Marie,</h1><p>Nous vous rappelons que votre atelier <strong>Formation du Faire ensemble - Niveau Initiation</strong> aura lieu le <strong>15 novembre 2025</strong> à <strong>09h00</strong>.</p><h2>Détails pratiques</h2><ul><li><strong>Lieu:</strong> Centre Culturel de Lyon, 25 rue de la Barre, 69002 Lyon</li><li><strong>Durée:</strong> Journée complète (9h-17h)</li></ul><p>À très bientôt!</p><p>L'équipe 1er Degré</p></body></html>",
  "merge_data": {
    "participant_name": "Marie",
    "workshop_title": "Formation du Faire ensemble - Niveau Initiation",
    "workshop_date": "15 novembre 2025",
    "workshop_time": "09h00",
    "location": "Centre Culturel de Lyon, 25 rue de la Barre, 69002 Lyon",
    "duration": "Journée complète (9h-17h)",
    "is_remote": false,
    "visio_link": null
  },
  "scheduled_at": "2025-11-13T09:00:00Z",
  "status": "sent",
  "sent_at": "2025-11-13T09:00:12Z",
  "error_message": null,
  "tenant_id": "1er-Degré",
  "created_at": "2025-11-11T15:22:00Z",
  "updated_at": "2025-11-13T09:00:12Z"
}
